{
  "engine_id": "whisper_cpp",
  "name": "whisper.cpp",
  "type": "audio",
  "subtype": "stt",
  "version": "1.0",
  "venv_family": "venv_stt",
  "description": "C++ implementation of Whisper - fast local STT with SRT/VTT subtitle output",
  "author": "ggerganov",
  "license": "MIT",
  "python_version": ">=3.8",
  "dependencies": {},
  "model_paths": {
    "base": "%PROGRAMDATA%\\VoiceStudio\\models\\whisper_cpp",
    "models": "%PROGRAMDATA%\\VoiceStudio\\models\\whisper_cpp\\models"
  },
  "supported_formats": [
    "wav",
    "mp3",
    "m4a",
    "flac",
    "ogg"
  ],
  "capabilities": [
    "speech_to_text",
    "transcription",
    "srt_generation",
    "vtt_generation",
    "word_timestamps",
    "language_detection"
  ],
  "device_requirements": {
    "gpu": "optional",
    "vram_min_gb": 0,
    "ram_min_gb": 2
  },
  "entry_point": "app.core.engines.whisper_cpp_engine.WhisperCPPEngine",
  "config_schema": {
    "executable_path": {
      "type": "string",
      "default": "tools\\whispercpp\\whisper.exe",
      "description": "Path to whisper.cpp executable"
    },
    "model": {
      "type": "string",
      "default": "base",
      "enum": [
        "tiny",
        "base",
        "small",
        "medium",
        "large",
        "large-v2",
        "large-v3"
      ],
      "description": "Whisper model size"
    },
    "language": {
      "type": "string",
      "default": "auto",
      "description": "Language code (auto for auto-detect)"
    },
    "output_format": {
      "type": "string",
      "default": "srt",
      "enum": [
        "txt",
        "srt",
        "vtt",
        "json"
      ],
      "description": "Output subtitle format"
    }
  },
  "contract": {
    "input": {
      "audio_formats": [
        "wav",
        "mp3",
        "flac",
        "ogg",
        "m4a"
      ],
      "sample_rates": [
        8000,
        16000,
        22050,
        44100,
        48000
      ],
      "max_duration_seconds": 3600,
      "min_duration_seconds": 0.1
    },
    "output": {
      "format": "json",
      "includes": [
        "text",
        "segments",
        "timestamps"
      ]
    },
    "resources": {
      "vram_mb": 0,
      "ram_mb": 2048,
      "timeout_seconds": 300
    }
  },
  "implementation_status": "full",
  "support_tier": "tier1_supported",
  "implementation_notes": "Fully implemented audio engine."
}