{
  "engine_id": "whisper_ui",
  "name": "Whisper UI",
  "type": "audio",
  "subtype": "stt",
  "version": "1.0",
  "venv_family": "venv_stt",
  "description": "Whisper UI - User interface wrapper for Whisper STT with enhanced features",
  "author": "Whisper UI Community",
  "license": "MIT",
  "python_version": ">=3.8",
  "dependencies": {
    "openai-whisper": ">=20230314",
    "faster-whisper": ">=1.0.0"
  },
  "model_paths": {
    "base": "%PROGRAMDATA%\\VoiceStudio\\models\\whisper_ui",
    "models": "%PROGRAMDATA%\\VoiceStudio\\models\\whisper_ui\\models"
  },
  "supported_formats": [
    "wav",
    "mp3",
    "m4a",
    "flac",
    "ogg"
  ],
  "capabilities": [
    "speech_to_text",
    "transcription",
    "translation",
    "word_timestamps",
    "language_detection",
    "gui_interface"
  ],
  "device_requirements": {
    "gpu": "optional",
    "vram_min_gb": 0,
    "ram_min_gb": 2
  },
  "entry_point": "app.core.engines.whisper_ui_engine.WhisperUIEngine",
  "config_schema": {
    "model": {
      "type": "string",
      "default": "base",
      "enum": [
        "tiny",
        "base",
        "small",
        "medium",
        "large",
        "large-v2",
        "large-v3"
      ],
      "description": "Whisper model size"
    },
    "language": {
      "type": "string",
      "default": "auto",
      "description": "Language code (auto for auto-detect)"
    },
    "device": {
      "type": "string",
      "default": "cpu",
      "enum": [
        "cuda",
        "cpu"
      ],
      "description": "Device to use for inference"
    },
    "use_faster_whisper": {
      "type": "boolean",
      "default": true,
      "description": "Use faster-whisper for faster inference"
    }
  },
  "contract": {
    "input": {
      "audio_formats": [
        "wav",
        "mp3",
        "flac",
        "ogg",
        "m4a"
      ],
      "sample_rates": [
        8000,
        16000,
        22050,
        44100,
        48000
      ],
      "max_duration_seconds": 3600,
      "min_duration_seconds": 0.1
    },
    "output": {
      "format": "json",
      "includes": [
        "text",
        "segments",
        "timestamps"
      ]
    },
    "resources": {
      "vram_mb": 0,
      "ram_mb": 2048,
      "timeout_seconds": 300
    }
  },
  "implementation_status": "basic",
  "implementation_notes": "Basic implementation. Some advanced features may be missing.",
  "support_tier": "tier2_best_effort"
}