{
  "engine_id": "xtts_v2",
  "name": "XTTS v2",
  "type": "audio",
  "subtype": "tts",
  "version": "2.0",
  "implementation_status": "full",
  "support_tier": "tier1_supported",
  "implementation_notes": "Fully implemented with voice cloning and multi-language TTS.",
  "venv_family": "venv_core_tts",
  "description": "Coqui TTS XTTS v2 for voice cloning and text-to-speech synthesis",
  "author": "Coqui",
  "license": "MPL-2.0",
  "python_version": ">=3.10",
  "dependencies": {
    "coqui-tts": "==0.27.2",
    "torch": ">=2.2.2",
    "transformers": ">=4.55.4"
  },
  "model_paths": {
    "base": "%PROGRAMDATA%\\VoiceStudio\\models\\xtts_v2",
    "cache": "%PROGRAMDATA%\\VoiceStudio\\models\\xtts_v2\\cache"
  },
  "supported_languages": ["en", "es", "fr", "de", "it", "pt", "pl", "tr", "ru", "nl", "cs", "ar", "zh-cn", "ja"],
  "capabilities": [
    "voice_cloning",
    "multi_language_tts",
    "emotion_control",
    "style_transfer"
  ],
  "device_requirements": {
    "gpu": "recommended",
    "vram_min_gb": 4,
    "ram_min_gb": 8
  },
  "contract": {
    "input": {
      "audio_formats": ["wav", "mp3", "flac", "ogg"],
      "sample_rates": [16000, 22050, 24000, 44100, 48000],
      "max_duration_seconds": 30,
      "min_duration_seconds": 1,
      "text_max_chars": 5000
    },
    "output": {
      "audio_format": "wav",
      "sample_rate": 24000,
      "bit_depth": 16,
      "channels": 1
    },
    "resources": {
      "vram_mb": 4096,
      "ram_mb": 8192,
      "cpu_threads": 4,
      "timeout_seconds": 120
    }
  },
  "entry_point": "app.core.engines.xtts_engine.XTTSEngine",
  "config_schema": {
    "model_name": {
      "type": "string",
      "default": "tts_models/multilingual/multi-dataset/xtts_v2",
      "description": "XTTS model identifier"
    },
    "device": {
      "type": "string",
      "default": "cuda",
      "enum": ["cuda", "cpu"],
      "description": "Device to use for inference"
    },
    "gpu": {
      "type": "boolean",
      "default": true,
      "description": "Whether to use GPU if available"
    }
  }
}

